{
  "context": {
    "explicit_in_source": true,
    "filled_by_pipeline": false,
    "framework": "ideal MHD Atlas H1-H5",
    "regime": "atlas, h3, rigid-beltrami",
    "system": "rotating helical Z-pinch"
  },
  "core": {
    "dimensions": [
      {
        "name": "ev_atlas_newcomb_bench",
        "scale": "normalized_binary",
        "uncertainty": null,
        "value": 1.0
      }
    ],
    "locked": true
  },
  "evidence_id": "ev_atlas_newcomb_bench",
  "label": "ARPACK recovers Newcomb 1960 m=1 eigenvalues to 1e-5 relative accuracy",
  "paper_id": "atlas2026",
  "provenance": {
    "confidence": 0.74,
    "extractor": "deterministic_seed",
    "review_status": "unreviewed",
    "source_span": "Global m = 1 Stabilization of a Rotating Helical Z-pinch at Finite Pressure A. Kumar,1 J. C. Turner,2 A. Stepanov,2 T. Karminskaya,2 J. Flygare,2 J. Dadras,2 and C. Rea1 1 Plasma Science and Fusion Center, Massachusetts Institute of Technology, Cambridge, MA 02139, USA 2"
  }
}
